{
  "version": "2.0",
  "timestamp": "2026-04-07T10:16:05Z",
  "hardware": {
    "model": "MacBook Pro",
    "chip": "Apple M2 Max",
    "total_ram_gb": 32,
    "available_ram_gb": 10.7,
    "cpu_cores": 12,
    "performance_cores": 8,
    "efficiency_cores": 4,
    "gpu_cores": "30",
    "os_version": "26.3.1",
    "power_source": "ac_power",
    "disk_available_gb": 267
  },
  "model": {
    "name": "Phi 4 14B",
    "id": "phi-4",
    "params": "14B",
    "quant": "Q4_K_M",
    "file_size_gb": 8.43
  },
  "runtime": {
    "name": "llama.cpp",
    "version": "unknown"
  },
  "parameters": {
    "n_gpu_layers": 99,
    "flash_attention": true,
    "threads": 0
  },
  "speed": {
    "pp128": 227.57,
    "pp256": 218.75,
    "pp512": 219.96,
    "tg128": 19.45,
    "tg256": 19.32
  },
  "memory": {
    "peak_rss_gb": 8.56
  }
}