{
  "version": "2.0",
  "timestamp": "2026-04-08T07:45:09Z",
  "hardware": {
    "model": "MacBook Air",
    "chip": "Apple M1",
    "total_ram_gb": 16,
    "available_ram_gb": 8.0,
    "cpu_cores": 8,
    "performance_cores": 4,
    "efficiency_cores": 4,
    "gpu_cores": "7",
    "os_version": "26.3.1",
    "power_source": "ac_power",
    "disk_available_gb": 19
  },
  "model": {
    "name": "DeepSeek R1 Distill 7B",
    "id": "deepseek-r1-distill-7b",
    "params": "7B",
    "quant": "Q4_K_M",
    "file_size_gb": 4.36
  },
  "runtime": {
    "name": "llama.cpp",
    "version": "unknown"
  },
  "parameters": {
    "n_gpu_layers": 99,
    "flash_attention": true,
    "threads": 0
  },
  "speed": {
    "pp128": 106.7,
    "pp256": 106.12,
    "pp512": 100.59,
    "tg128": 11.47,
    "tg256": 11.13
  },
  "memory": {
    "peak_rss_gb": 4.47
  }
}