{
  "version": "2.0",
  "timestamp": "2026-04-07T08:20:15Z",
  "hardware": {
    "model": "MacBook Air",
    "chip": "Apple M1",
    "total_ram_gb": 16,
    "available_ram_gb": 9.2,
    "cpu_cores": 8,
    "performance_cores": 4,
    "efficiency_cores": 4,
    "gpu_cores": "7",
    "os_version": "26.3.1",
    "power_source": "ac_power",
    "disk_available_gb": 33
  },
  "model": {
    "name": "Qwen3-8B-4bit",
    "id": "Qwen3-8B-4bit",
    "params": "8B",
    "quant": "4bit",
    "file_size_gb": 0
  },
  "runtime": {
    "name": "llama.cpp",
    "version": "unknown"
  },
  "parameters": {
    "n_gpu_layers": 99,
    "flash_attention": true,
    "threads": 0
  },
  "speed": {
    "pp128": 65.53,
    "tg128": 12.49,
    "tg256": 12.81,
    "pp256": 68.08,
    "pp512": 67.77
  },
  "memory": {
    "peak_rss_gb": 5.123
  }
}