{
  "version": "2.0",
  "timestamp": "2026-04-06T14:30:04Z",
  "hardware": {
    "model": "MacBook Air",
    "chip": "Apple M5",
    "total_ram_gb": 32,
    "available_ram_gb": 18.4,
    "cpu_cores": 10,
    "performance_cores": 4,
    "efficiency_cores": 6,
    "gpu_cores": "10",
    "os_version": "26.4",
    "power_source": "ac_power",
    "disk_available_gb": 758
  },
  "model": {
    "name": "Llama 3.1 8B Instruct",
    "id": "llama-3.1-8b",
    "params": "8B",
    "quant": "Q4_K_M",
    "file_size_gb": 4.58
  },
  "runtime": {
    "name": "llama.cpp",
    "version": "unknown"
  },
  "parameters": {
    "n_gpu_layers": 99,
    "flash_attention": true,
    "threads": 0
  },
  "speed": {
    "pp128": 185.06,
    "pp256": 180.56,
    "pp512": 179.32,
    "tg128": 10.75,
    "tg256": 10.68
  },
  "memory": {
    "peak_rss_gb": 4.72
  }
}