{
  "version": "2.0",
  "timestamp": "2026-04-07T18:03:59Z",
  "hardware": {
    "model": "MacBook Air",
    "chip": "Apple M5",
    "total_ram_gb": 32,
    "available_ram_gb": 17.8,
    "cpu_cores": 10,
    "performance_cores": 4,
    "efficiency_cores": 6,
    "gpu_cores": "10",
    "os_version": "26.4",
    "power_source": "ac_power",
    "disk_available_gb": 738
  },
  "model": {
    "name": "Meta-Llama-3.1-8B-Instruct-4bit",
    "id": "Meta-Llama-3.1-8B-Instruct-4bit",
    "params": "8B",
    "quant": "4bit",
    "file_size_gb": 0
  },
  "runtime": {
    "name": "llama.cpp",
    "version": "unknown"
  },
  "parameters": {
    "n_gpu_layers": 99,
    "flash_attention": true,
    "threads": 0
  },
  "speed": {
    "pp128": 549.88,
    "tg128": 28.31,
    "tg256": 28.71,
    "pp256": 647.63,
    "pp512": 527.98
  },
  "memory": {
    "peak_rss_gb": 5.058
  }
}