{
  "version": "2.0",
  "timestamp": "2026-04-06T20:12:10Z",
  "hardware": {
    "model": "MacBook Air",
    "chip": "Apple M5",
    "total_ram_gb": 32,
    "available_ram_gb": 17.1,
    "cpu_cores": 10,
    "performance_cores": 4,
    "efficiency_cores": 6,
    "gpu_cores": "10",
    "os_version": "26.4",
    "power_source": "ac_power",
    "disk_available_gb": 761
  },
  "model": {
    "name": "Qwen3-0.6B-4bit",
    "id": "Qwen3-0.6B-4bit",
    "params": "0.6B",
    "quant": "4bit",
    "file_size_gb": 0
  },
  "runtime": {
    "name": "llama.cpp",
    "version": "unknown"
  },
  "parameters": {
    "n_gpu_layers": 99,
    "flash_attention": true,
    "threads": 0
  },
  "speed": {
    "pp128": 2750.16,
    "tg128": 259.06,
    "tg256": 270.81,
    "pp256": 2985.87,
    "pp512": 3108.41
  },
  "memory": {
    "peak_rss_gb": 0.871
  }
}