{
  "version": "2.0",
  "timestamp": "2026-04-07T20:41:11Z",
  "hardware": {
    "model": "MacBook Air",
    "chip": "Apple M1",
    "total_ram_gb": 16,
    "available_ram_gb": 8.7,
    "cpu_cores": 8,
    "performance_cores": 4,
    "efficiency_cores": 4,
    "gpu_cores": "7",
    "os_version": "26.3.1",
    "power_source": "ac_power",
    "disk_available_gb": 21
  },
  "model": {
    "name": "Phi 4 Mini Reasoning 3.8B",
    "id": "phi-4-mini-reasoning",
    "params": "3.8B",
    "quant": "Q4_K_M",
    "file_size_gb": 2.32
  },
  "runtime": {
    "name": "llama.cpp",
    "version": "unknown"
  },
  "parameters": {
    "n_gpu_layers": 99,
    "flash_attention": true,
    "threads": 0
  },
  "speed": {
    "pp128": 210.79,
    "pp256": 210.29,
    "pp512": 208.99,
    "tg128": 19.86,
    "tg256": 18.39
  },
  "memory": {
    "peak_rss_gb": 2.45
  }
}