{
  "version": "2.0",
  "timestamp": "2026-04-05T19:53:22Z",
  "hardware": {
    "model": "MacBook Air",
    "chip": "Apple M5",
    "total_ram_gb": 32,
    "available_ram_gb": 17.8,
    "cpu_cores": 10,
    "performance_cores": 4,
    "efficiency_cores": 6,
    "gpu_cores": "10",
    "os_version": "26.4",
    "power_source": "ac_power",
    "disk_available_gb": 764
  },
  "model": {
    "name": "Qwen 3 0.6B",
    "id": "qwen3-0.6b",
    "params": "0.6B",
    "quant": "Q4_K_M",
    "file_size_gb": 0.45
  },
  "runtime": {
    "name": "llama.cpp",
    "version": "unknown"
  },
  "parameters": {
    "n_gpu_layers": 99,
    "flash_attention": true,
    "threads": 0
  },
  "speed": {
    "pp128": 4840.17,
    "pp256": 2012.94,
    "pp512": 1977.75,
    "tg128": 91.9,
    "tg256": 89.82
  },
  "memory": {
    "peak_rss_gb": 0.57
  }
}